{
  "version": "1.0.0",
  "owner": "Peter Stuiber / ananta888",
  "track": "orbit-core-foundation",
  "purpose": "Ausführbares modulares VR/MR-Fundament und nachvollziehbarer Ausbau zu Orbit – Wilde Inseln.",
  "goal": "Laptop und Quest ergänzen sich; Content, Simulation, Charaktere und Lernsystem bleiben unabhängig erweiterbar.",
  "status_scale": [
    "todo",
    "in_progress",
    "partial",
    "blocked",
    "done"
  ],
  "priority_scale": [
    "P0",
    "P1",
    "P2",
    "P3"
  ],
  "risk_scale": [
    "low",
    "medium",
    "high"
  ],
  "milestones": [
    {
      "id": "REPO",
      "title": "Repository Bootstrap",
      "status": "done",
      "task_ids": [
        "REPO-BOOT",
        "REPO-PUBLISH"
      ]
    },
    {
      "id": "ARCH",
      "title": "Architecture",
      "status": "in_progress",
      "task_ids": [
        "ARCH-PORTS",
        "ARCH-OWNERS",
        "ARCH-TYPES"
      ]
    },
    {
      "id": "XR",
      "title": "WebXR Client",
      "status": "in_progress",
      "task_ids": [
        "XR-MODES",
        "XR-MISSIONS",
        "XR-DEVICE",
        "XR-SPATIAL",
        "XR-HAND-UI",
        "XR-EMBODIMENT"
      ]
    },
    {
      "id": "SERVER",
      "title": "Server Runtime",
      "status": "in_progress",
      "task_ids": [
        "SERVER-LOOP",
        "SERVER-BUDGET"
      ]
    },
    {
      "id": "NET",
      "title": "Networking",
      "status": "in_progress",
      "task_ids": [
        "NET-CONTRACT",
        "NET-PAIR",
        "NET-WINDOWS-START"
      ]
    },
    {
      "id": "PACK",
      "title": "Mission Packages",
      "status": "in_progress",
      "task_ids": [
        "PACK-SCHEMA",
        "PACK-EXAMPLES",
        "PACK-HOTLOAD",
        "PACK-BUILD",
        "PACK-INSTALL"
      ]
    },
    {
      "id": "WORLD",
      "title": "World Streaming",
      "status": "in_progress",
      "task_ids": [
        "WORLD-CHUNKS",
        "WORLD-ART",
        "WORLD-PLANET",
        "WORLD-VISUAL-PASS"
      ]
    },
    {
      "id": "BOW",
      "title": "Bow",
      "status": "in_progress",
      "task_ids": [
        "BOW-BALLISTICS",
        "BOW-MATERIALS"
      ]
    },
    {
      "id": "ARIN",
      "title": "Dragon / Arin",
      "status": "in_progress",
      "task_ids": [
        "ARIN-FLIGHT",
        "ARIN-MEMORY",
        "ARIN-CHARACTER"
      ]
    },
    {
      "id": "ORACLE",
      "title": "Ananta Oracle",
      "status": "in_progress",
      "task_ids": [
        "ORACLE-HINTS",
        "ORACLE-CONTEXT"
      ]
    },
    {
      "id": "SPEECH",
      "title": "Speech",
      "status": "in_progress",
      "task_ids": [
        "SPEECH-ADAPTERS",
        "SPEECH-CAPTURE",
        "SPEECH-GPU"
      ]
    },
    {
      "id": "AI",
      "title": "AI",
      "status": "in_progress",
      "task_ids": [
        "AI-BOUNDS",
        "AI-JEV",
        "AI-ACTIONS"
      ]
    },
    {
      "id": "LEARN",
      "title": "Learning System",
      "status": "in_progress",
      "task_ids": [
        "LEARN-OBSERVATIONS",
        "LEARN-ADAPT",
        "LEARN-EPISODES"
      ]
    },
    {
      "id": "FIT",
      "title": "Fitness",
      "status": "in_progress",
      "task_ids": [
        "FIT-PROFILES",
        "FIT-MOVEMENT"
      ]
    },
    {
      "id": "SAVE",
      "title": "Persistence",
      "status": "in_progress",
      "task_ids": [
        "SAVE-LOCAL",
        "SAVE-MIGRATE"
      ]
    },
    {
      "id": "TEST",
      "title": "Testing",
      "status": "in_progress",
      "task_ids": [
        "TEST-CI",
        "TEST-HARDWARE"
      ]
    },
    {
      "id": "DOC",
      "title": "Documentation",
      "status": "done",
      "task_ids": [
        "DOC-SPEC",
        "DOC-TRACK"
      ]
    }
  ],
  "tasks": [
    {
      "id": "REPO-BOOT",
      "title": "BSD-Monorepo und reproduzierbare Entwicklungsumgebung",
      "status": "done",
      "type": "implementation",
      "milestone_id": "REPO",
      "priority": "P0",
      "risk": "low",
      "progress_percent": 100,
      "dependencies": [],
      "affected_files": [
        "README.md",
        "LICENSE",
        "pyproject.toml",
        "package.json"
      ],
      "acceptance_criteria": [
        "Python-Paket, npm-Lock und BSD-Lizenz vorhanden; keine Modelle oder Laufzeitdaten veröffentlicht."
      ],
      "tests": [
        "python -m pytest; npm ci; npm test"
      ],
      "definition_of_done": [
        "Akzeptanzkriterien durch überprüfbare Ergebnisse erfüllt.",
        "Relevante Tests bestanden und Dokumentation sowie TODO-Status aktualisiert."
      ],
      "evidence": [
        "Lokale Foundation-Abnahme: docs/testing.md; zugehörige Testbefehle im Feld tests."
      ]
    },
    {
      "id": "REPO-PUBLISH",
      "title": "Öffentliches Repository unter ananta888 mit main veröffentlichen",
      "status": "done",
      "type": "publication",
      "milestone_id": "REPO",
      "priority": "P0",
      "risk": "low",
      "progress_percent": 100,
      "dependencies": [
        "DOC-SPEC",
        "DOC-TRACK",
        "TEST-CI"
      ],
      "affected_files": [
        "README.md",
        "LICENSE",
        "pyproject.toml",
        "package.json"
      ],
      "acceptance_criteria": [
        "GitHub-Repository ist public; Default-Branch main; lokaler Commit entspricht origin/main."
      ],
      "tests": [
        "gh repo view ananta888/orbit-wilde-inseln; git ls-remote origin refs/heads/main"
      ],
      "definition_of_done": [
        "Akzeptanzkriterien durch überprüfbare Ergebnisse erfüllt.",
        "Relevante Tests bestanden und Dokumentation sowie TODO-Status aktualisiert."
      ],
      "evidence": [
        "https://github.com/ananta888/orbit-wilde-inseln",
        "GitHub bestätigt PUBLIC, main und BSD-3-Clause; initialer Commit c459988816e6e11ede72331a6aecd8b2fb92aa1a wurde mit origin/main abgeglichen."
      ]
    },
    {
      "id": "ARCH-PORTS",
      "title": "Domänengrenzen und austauschbare Provider definieren",
      "status": "done",
      "type": "implementation",
      "milestone_id": "ARCH",
      "priority": "P0",
      "risk": "low",
      "progress_percent": 100,
      "dependencies": [
        "REPO-BOOT"
      ],
      "affected_files": [
        "ARCHITECTURE.md",
        "docs/architecture/adr",
        "server/orbit_server"
      ],
      "acceptance_criteria": [
        "Simulation ohne HTTP; AI und Speech über Ports; konkrete ADRs mit geprüften Alternativen."
      ],
      "tests": [
        "python -m mypy; python -m pytest tests/test_mission_runtime.py"
      ],
      "definition_of_done": [
        "Akzeptanzkriterien durch überprüfbare Ergebnisse erfüllt.",
        "Relevante Tests bestanden und Dokumentation sowie TODO-Status aktualisiert."
      ],
      "evidence": [
        "Lokale Foundation-Abnahme: docs/testing.md; zugehörige Testbefehle im Feld tests."
      ]
    },
    {
      "id": "ARCH-OWNERS",
      "title": "Arbeitsregeln für Entwickler und Coding-Agenten dokumentieren",
      "status": "done",
      "type": "implementation",
      "milestone_id": "ARCH",
      "priority": "P0",
      "risk": "low",
      "progress_percent": 100,
      "dependencies": [
        "REPO-BOOT"
      ],
      "affected_files": [
        "ARCHITECTURE.md",
        "docs/architecture/adr",
        "server/orbit_server"
      ],
      "acceptance_criteria": [
        "AGENTS.md weist Verzeichnisse, Verträge, Testregeln und Lizenzgrenzen eindeutig zu."
      ],
      "tests": [
        "python tools/validate_todos.py"
      ],
      "definition_of_done": [
        "Akzeptanzkriterien durch überprüfbare Ergebnisse erfüllt.",
        "Relevante Tests bestanden und Dokumentation sowie TODO-Status aktualisiert."
      ],
      "evidence": [
        "Lokale Foundation-Abnahme: docs/testing.md; zugehörige Testbefehle im Feld tests."
      ]
    },
    {
      "id": "ARCH-TYPES",
      "title": "Typabdeckung des übernommenen Rendering- und Physikcodes erweitern",
      "status": "todo",
      "type": "implementation",
      "milestone_id": "ARCH",
      "priority": "P2",
      "risk": "medium",
      "progress_percent": 0,
      "dependencies": [
        "REPO-BOOT",
        "ARCH-PORTS"
      ],
      "affected_files": [
        "ARCHITECTURE.md",
        "docs/architecture/adr",
        "server/orbit_server"
      ],
      "acceptance_criteria": [
        "Alle öffentlichen Simulationseinstiegspunkte und XR-Nachrichten werden statisch geprüft."
      ],
      "tests": [
        "mypy --strict server/orbit_server; TypeScript checkJs für den gesamten Client"
      ],
      "definition_of_done": [
        "Akzeptanzkriterien durch überprüfbare Ergebnisse erfüllt.",
        "Relevante Tests bestanden und Dokumentation sowie TODO-Status aktualisiert."
      ],
      "evidence": []
    },
    {
      "id": "XR-MODES",
      "title": "VR und Passthrough-MR mit lokalem Tracking integrieren",
      "status": "done",
      "type": "implementation",
      "milestone_id": "XR",
      "priority": "P0",
      "risk": "low",
      "progress_percent": 100,
      "dependencies": [
        "REPO-BOOT"
      ],
      "affected_files": [
        "client/webxr/src/xr",
        "client/webxr/src/input",
        "client/webxr/src/ui"
      ],
      "acceptance_criteria": [
        "Zwei Session-Modi; MR ohne künstliche Fortbewegung; lokale Kopfbewegung bleibt frei."
      ],
      "tests": [
        "npm run test:xr"
      ],
      "definition_of_done": [
        "Akzeptanzkriterien durch überprüfbare Ergebnisse erfüllt.",
        "Relevante Tests bestanden und Dokumentation sowie TODO-Status aktualisiert."
      ],
      "evidence": [
        "Lokale Foundation-Abnahme: docs/testing.md; zugehörige Testbefehle im Feld tests."
      ]
    },
    {
      "id": "XR-MISSIONS",
      "title": "Missionsauswahl und Hinweise mit Controller/Hand-Pinch anbieten",
      "status": "done",
      "type": "implementation",